{
  "schemaVersion": "ub4-perf-baseline/v1",
  "generatedAt": "2026-07-26T06:21:41.155Z",
  "capture": {
    "command": "node --expose-gc benchmarks/scripts/ub4-perf-baseline.js --output <result.json>",
    "warmupBatches": 10,
    "sampleCount": 31,
    "samplingSeed": 418992731,
    "isolatedChildSamples": 7,
    "excludedArtifactPaths": [
      "benchmarks/results/ub4-perf-baseline-2026-07-25-darwin-arm64-rereview.json",
      "benchmarks/results/ub4-perf-baseline-2026-07-25-darwin-arm64-rereview.receipt.json"
    ]
  },
  "sourceWindow": {
    "before": {
      "commit": "8eee967a521f4f4f6b22e642916ca2535b8c3c84",
      "dirty": {
        "isDirty": true,
        "changedPathCount": 108,
        "statusNulSha256": "5a8b8dcb59fad486bce0107c2f0f532c2ea9efc1fdd6aa9e60dae2f4ffdb737d"
      }
    },
    "after": {
      "commit": "8eee967a521f4f4f6b22e642916ca2535b8c3c84",
      "dirty": {
        "isDirty": true,
        "changedPathCount": 108,
        "statusNulSha256": "5a8b8dcb59fad486bce0107c2f0f532c2ea9efc1fdd6aa9e60dae2f4ffdb737d"
      }
    },
    "stable": true
  },
  "environment": {
    "platform": "darwin",
    "architecture": "arm64",
    "node": "v22.16.0",
    "v8": "12.4.254.21-node.26",
    "osRelease": "25.5.0",
    "cpuModel": "Apple M1 Max",
    "logicalCpuCount": 10,
    "timezone": "America/Los_Angeles",
    "xcode": "Xcode 26.6\nBuild version 17F113",
    "macos": "26.5.2"
  },
  "proofBoundary": {
    "level": "L1-deterministic-and-L3-node-napi-only",
    "physicalRadio": {
      "status": "blocked",
      "blocker": "No scan, connect, discovery, subscription, or write against a physical BLE controller/device occurred."
    },
    "electronAbi": {
      "status": "blocked",
      "blocker": "The fresh-process probe uses the Node N-API ABI only; it does not run the addon under Electron."
    },
    "electronRendererIpc": {
      "status": "blocked",
      "blocker": "Node child_process serialization is not Electron main-to-renderer IPC."
    }
  },
  "methodology": {
    "clock": "process.hrtime.bigint monotonic nanoseconds normalized per operation.",
    "warmup": "Ten full randomized warmup batches per operation before timed sampling.",
    "sampling": "Thirty-one raw samples per operation; Node N-API uses thirty-one fresh child processes and resources use seven GC-isolated child processes.",
    "interleaving": "A deterministic seeded permutation interleaves operation batches to reduce fixed-order cache and scheduler bias.",
    "estimator": "Nearest-rank p50/p95/p99 over 31 samples; p95 is the 30th ordered sample, not the maximum.",
    "confidence": "Dirty-machine local characterization only. No numeric release budget freezes until repeated clean-environment capture series are retained.",
    "isolation": "Resource and Node N-API probes use fresh child processes; IPC uses a dedicated advanced-serialization child process.",
    "scope": "No RN binary bridge, zero-copy claim, Electron ABI/renderer IPC, physical radio, or package-release proof."
  },
  "buildProvenance": {
    "status": "blocked",
    "blocker": "This capture fingerprints stable prebuilt outputs but has no isolated source-to-output build receipt; build-dependent release budgets remain blocked.",
    "modules": [
      {
        "path": "lib/commonjs/encoding.js",
        "before": {
          "bytes": 2753,
          "sha256": "146e246f504f5d4e01b20116e1f6a97f7064ff53c402a1e7d9234109b3984065"
        },
        "after": {
          "bytes": 2753,
          "sha256": "146e246f504f5d4e01b20116e1f6a97f7064ff53c402a1e7d9234109b3984065"
        }
      },
      {
        "path": "lib/commonjs/port/BlePort.js",
        "before": {
          "bytes": 13628,
          "sha256": "8eddb1042cb95332446250f79a162e3ec4f3b1db3bffc5927504c7109ddbf3f3"
        },
        "after": {
          "bytes": 13628,
          "sha256": "8eddb1042cb95332446250f79a162e3ec4f3b1db3bffc5927504c7109ddbf3f3"
        }
      },
      {
        "path": "lib/commonjs/port/PortBleManager.js",
        "before": {
          "bytes": 22275,
          "sha256": "b1d3d96dea636d5e0598dd373911ba4508b573ce386ad6f7a05cc6fd63f60fd5"
        },
        "after": {
          "bytes": 22275,
          "sha256": "b1d3d96dea636d5e0598dd373911ba4508b573ce386ad6f7a05cc6fd63f60fd5"
        }
      },
      {
        "path": "lib/commonjs/DeviceOperationQueue.js",
        "before": {
          "bytes": 7673,
          "sha256": "28849280696ae9cfd6215d557880f71ac904011b24998c87032acbe5d83d777a"
        },
        "after": {
          "bytes": 7673,
          "sha256": "28849280696ae9cfd6215d557880f71ac904011b24998c87032acbe5d83d777a"
        }
      },
      {
        "path": "native/electron/corebluetooth/index.js",
        "before": {
          "bytes": 9687,
          "sha256": "3d682dd8dbff245cdf123dd179e089bb3d0e3bf663e7f888173c2555594d87c9"
        },
        "after": {
          "bytes": 9687,
          "sha256": "3d682dd8dbff245cdf123dd179e089bb3d0e3bf663e7f888173c2555594d87c9"
        }
      },
      {
        "path": "native/electron/corebluetooth/build/Release/unified_ble_corebluetooth.node",
        "before": {
          "bytes": 222384,
          "sha256": "e86ce32fa04668a9102f8e92a784fecdf6a73efa50a2e0a8ff197e65c10c2cfb"
        },
        "after": {
          "bytes": 222384,
          "sha256": "e86ce32fa04668a9102f8e92a784fecdf6a73efa50a2e0a8ff197e65c10c2cfb"
        }
      }
    ]
  },
  "measurements": [
    {
      "id": "codec-base64-and-byte-copy",
      "classification": "deterministic-microbenchmark",
      "status": "passed",
      "method": "Compiled Node Buffer-backed codec versus explicit Uint8Array copy. Preflight verifies complete payload equality before randomized/interleaved timed batches.",
      "payloads": [
        {
          "id": "payload-0-offset-0",
          "byteLength": 0,
          "byteOffset": 0,
          "encodedBytes": 0,
          "encodedExpansionRatio": null,
          "operations": [
            {
              "id": "byte-copy",
              "warmupBatches": 10,
              "iterationsPerSample": 100000,
              "samplesNsPerOperation": [
                116.825,
                119.58291,
                114.51791,
                123.06,
                123.31875,
                115.59417,
                116.07792,
                116.18292,
                116.35708,
                118.02458,
                118.37417,
                118.51,
                116.32208,
                132.33875,
                113.06083,
                118.16083,
                116.12375,
                120.93667,
                114.85,
                113.45584,
                123.0175,
                115.59666,
                125.64042,
                127.41,
                118.075,
                113.74083,
                116.82708,
                120.70084,
                115.035,
                118.25666,
                124.1425
              ],
              "statistics": {
                "count": 31,
                "min": 113.06083,
                "max": 132.33875,
                "mean": 118.71344,
                "standardDeviation": 4.387817,
                "p50": 118.02458,
                "p95": 127.41,
                "p99": 132.33875
              },
              "integrity": {
                "algorithm": "sha256",
                "inputSha256": "e3b0c44298fc1c149afbf4c8996fb92427ae41e4649b934ca495991b7852b855",
                "outputSha256": "e3b0c44298fc1c149afbf4c8996fb92427ae41e4649b934ca495991b7852b855",
                "verified": true
              }
            },
            {
              "id": "base64-encode",
              "warmupBatches": 10,
              "iterationsPerSample": 100000,
              "samplesNsPerOperation": [
                8.18958,
                8.24208,
                8.3025,
                9.14708,
                8.62042,
                8.75291,
                8.18916,
                7.94584,
                8.34666,
                8.17083,
                8.05125,
                7.94041,
                8.32834,
                8.15125,
                8.76625,
                8.08208,
                7.97375,
                7.9575,
                8.05208,
                7.9725,
                8.19417,
                9.30416,
                8.4325,
                7.85125,
                8.49292,
                8.65125,
                8.1975,
                9.0325,
                8.22,
                8.19166,
                7.86917
              ],
              "statistics": {
                "count": 31,
                "min": 7.85125,
                "max": 9.30416,
                "mean": 8.310308,
                "standardDeviation": 0.36876,
                "p50": 8.19417,
                "p95": 9.14708,
                "p99": 9.30416
              },
              "integrity": {
                "algorithm": "sha256",
                "inputSha256": "e3b0c44298fc1c149afbf4c8996fb92427ae41e4649b934ca495991b7852b855",
                "outputSha256": "e3b0c44298fc1c149afbf4c8996fb92427ae41e4649b934ca495991b7852b855",
                "verified": true
              }
            },
            {
              "id": "base64-decode",
              "warmupBatches": 10,
              "iterationsPerSample": 100000,
              "samplesNsPerOperation": [
                119.05625,
                122.96958,
                118.80709,
                123.28542,
                115.5525,
                121.23166,
                117.59125,
                117.19667,
                126.12958,
                122.93166,
                119.46833,
                123.23292,
                118.83459,
                136.68,
                114.89542,
                113.49917,
                114.01,
                120.94708,
                112.6325,
                112.92792,
                117.03458,